{
  "schema": "mission-book.goal-package",
  "version": 1,
  "packageId": "flutter-course-pilot-2026-11-r1",
  "goal": {
    "title": "Dart 与 Flutter 课标试运行",
    "description": "示例课程，用于检查大纲、具体课次、排期与材料流程；不是用户真实课标。",
    "why": "验证外部 AI 生成计划后能否导入并实际执行"
  },
  "defaults": {
    "timeZone": "Asia/Shanghai",
    "plannedDurationMinutes": 45,
    "verificationPolicy": "SELF_REPORT"
  },
  "nodes": [
    {
      "key": "foundations",
      "title": "基础知识",
      "children": [
        {
          "key": "dart-values",
          "title": "Dart 值与参数",
          "description": "理解值由谁提供、传给谁，以及函数的返回值"
        },
        {
          "key": "widget-tree",
          "title": "Widget 组合",
          "description": "能够说明父子组件关系及参数来源"
        }
      ]
    },
    {
      "key": "practice",
      "title": "综合实践",
      "children": [
        {
          "key": "adaptive-layout",
          "title": "自适应布局"
        },
        {
          "key": "mini-project",
          "title": "小型项目"
        }
      ]
    }
  ],
  "missions": [
    {
      "key": "s01-dart-20261102",
      "nodeKey": "dart-values",
      "title": "用一个函数说明参数与返回值",
      "why": "把基础语法落实为可以运行和解释的例子",
      "schedule": {
        "scheduledDate": "2026-11-02",
        "timePolicy": "FIXED",
        "fixedStartAt": "2026-11-02T19:00:00+08:00"
      },
      "executionPlan": {
        "objective": "写出接收两个整数并返回计算结果的函数，解释一次真实调用",
        "steps": [
          "先说明参数的提供者和返回值的接收者",
          "编写函数及调用，运行后核对结果",
          "换一组参数，再独立解释值的流动"
        ],
        "notes": "这是固定课次；计划结束时刻不会自动生成 END。"
      }
    },
    {
      "key": "s02-widget-20261103",
      "nodeKey": "widget-tree",
      "title": "画出并实现一个简单 Widget 树",
      "verificationPolicy": "OPTIONAL_EVIDENCE",
      "schedule": {
        "scheduledDate": "2026-11-03",
        "timePolicy": "FLEXIBLE"
      },
      "executionPlan": {
        "steps": [
          "先画出父子组件及参数来源",
          "实现并运行一个含标题与按钮的区域"
        ],
        "verificationCriteria": "可选提交运行截图和一段组件关系说明"
      }
    },
    {
      "key": "s03-layout-20261104",
      "nodeKey": "adaptive-layout",
      "title": "完成窄窗与宽窗的布局切换",
      "verificationPolicy": "REQUIRED_EVIDENCE",
      "schedule": {
        "scheduledDate": "2026-11-04",
        "timePolicy": "FIXED",
        "fixedStartAt": "2026-11-04T19:00:00+08:00",
        "evidenceDeadlineAt": "2026-11-04T23:00:00+08:00"
      },
      "executionPlan": {
        "objective": "让同一页面在两种宽度下都能完整阅读和操作",
        "steps": ["检查可用宽度", "实现分栏与纵排", "检查放大文字后的操作"],
        "verificationCriteria": "提交两种宽度的截图，并说明布局选择依据"
      }
    },
    {
      "key": "s04-project-20261105",
      "nodeKey": "mini-project",
      "title": "把前几次练习组合为一个小页面",
      "verificationPolicy": "REQUIRED_EVIDENCE",
      "schedule": {
        "scheduledDate": "2026-11-05",
        "timePolicy": "FIXED",
        "fixedStartAt": "2026-11-05T19:00:00+08:00",
        "plannedDurationMinutes": 90
      },
      "executionPlan": {
        "steps": ["明确页面用途", "组合现有组件", "实际运行并记录结果"],
        "verificationCriteria": "提交运行截图和关键代码；说明一次完整的调用过程",
        "notes": "省略材料截止，由导入预览明确展开为排期日次日零点。"
      }
    },
    {
      "key": "s05-review-20261106",
      "title": "回看本周课程并调整下一周安排",
      "schedule": {
        "scheduledDate": "2026-11-06",
        "timePolicy": "FLEXIBLE",
        "plannedDurationMinutes": 30
      },
      "executionPlan": {
        "steps": ["查看真实执行记录", "记录未解决的问题", "决定下一周练习方向"]
      }
    }
  ]
}
